{"schema":"AIFC/completeness-basis-authority-reachability-implementation-binding/v1","binding_id":"AIFC-SAL-V1.14-COMPLETENESS-BASIS-AUTHORITY-REACHABILITY-IMPLEMENTATION-BINDING-V1","reachability_profile_id":"AIFC-SAL-V1.14-COMPLETENESS-BASIS-AUTHORITY-REACHABILITY-PROFILE-V1","reachability_profile_content_hash":"239be79f273b6ebea67639b0c414780c941a41a5ea85e2c2d13741a8ee27ae5e","implementation_path":"reference/verifier/completeness_basis_authority_reachability_v1.py","implementation_git_blob_sha1":"09af1cafbefd54bb73826288118199e6fb0408d0","implementation_raw_sha256":"a462e3679cf881a777d4e01d26def794dd7418b5e7ebf6af77b3ddc7b7a7c5c3","binding_status":"CONFIRMED_DUAL_BOUND_CANDIDATE_EXECUTION_IDENTITY","authority_status":"NOT_ESTABLISHED","binding_content_hash":"40fc871b358610c3551ed38fa6588a75035e60fdac7efed6e8ab76ad7e91e189"}
